{
  "ambiguityID": "example",
  "dimensionID": "b0",
  "candidateValues": [
    0,
    0
  ],
  "evidence": [
    {}
  ],
  "blockingRule": {
    "ruleID": "ASH-STATE-VALIDITY-001",
    "sourceReference": "example",
    "ruleFamily": "example"
  },
  "diagnosticReference": {
    "diagnosticID": "example",
    "chainRootReference": "example",
    "diagnosticKind": "STATE_VALIDITY",
    "ruleReferences": [
      {
        "ruleID": "ASH-STATE-VALIDITY-001",
        "sourceReference": "example",
        "ruleFamily": "example"
      }
    ]
  }
}
